uuid,tweet
83a348e4-5453-4a64-ae50-2e93e9db3c00,"RT @MaraWilson: The ""Those Who Trespass"" (yes, that is the title of his stupid book) episode of @IDEOTVPod is fucking gold https://t.co/loOâ¦"
3c02eea6-8dde-4b11-b721-bd7f685d6b4b,i hate seein old bullies from school bc like wtf am i anxious for y’all dead ugly and ugly spirited kys stupid hoe
74f822d0-ff39-4170-aedb-6e7245706d12,"No, wanting to deny people healthcare, spreading anti-Muslim conspiracy theories, retweeting Richard spencer and orher alt-right idiots means you do have problems with people. You just don't want to face any semblance of responsibility for choosing to be a shit person."
a98e856c-a652-4221-a258-fef0e8f7cee6,RT @a_man_in_black: @freebsdgirl link btw https://t.co/bnNDBC5ob4
04c114c1-d068-485e-aa2f-c93f1cd384c7,I do believe in Quran and I know I was human.I'm taking about you an idiot .I said hind are converted monkey to hind .you are different kind of species. Monkey to hind . But we Muslims adam and hawa to muslims . but monkey are always monkey .You never forget your ancestors
429751df-5f88-4ff0-9466-111e608a1b1d,It’s pretty funny how many gay men (and some women) have drunk the far right kool aid. Like kids in the playground desperate to be accepted by the bully. Rape jokes are not working class banter.
95631e27-cb7a-48e1-9648-e1d3d96db4d9,Have you noticed that Ilham Omar and they team are not showed kneeling? MUSLIMS ARE PROHIBITED TO KNEEL TO ANYONE BUT GOD And the rest of those stupid idiots are kneeling for anything OBEY MORONS
1d204b38-05df-43ac-93fc-cb2a0eae7d45,"@98Halima @johnnygjokaj @rfrankh53 @BilalIGhumman @cdnKhadija No Muslim land has ever lived under anything but tyrants, dummy."
49b1ee43-707a-4600-942a-b5c73966cec2,"RT @ifihadanocelot: @antifempsycho2 @Angry_Feminazi @MT8_9 ""hey I have a gender studies degree, clearly YOU ALL are the brainwashed ones"""
c9d3d32c-c480-432e-a73d-d820343c87c8,The majority of these people are guys or girls who were bullied or beaten up in high school. This lines up the desire of power trip and better even with everyone
5048116f-66c8-442f-b6ae-e3fdeb811d1b,"@_Dward24 Shut the fuck up you dumb ass nigger. You wanna try and kill me? Dumb ass, you wont get through my lawn. Dumb Wellfare fuck"
8d6058e0-5ab5-45d8-9289-e34c5b698d73,"There was one guy in high school who bullied me and told me if his kids were gay he'd throw them over a bridge and now he's dating a girl that I used to be really cool with n I wanna ask her if they had a gay kid if he would still kill it, like asking the real REAL questions"
4779b6aa-60e9-4d4f-9245-a66144971ca1,"@a_man_in_black it's hard to not have those feelings sometimes. maybe step back/break for the night? or do what i do, use it as motivation."
90935142-ab78-4210-ad50-477f206df802,@MileyCyrus fuck the dumb nigger you look beautiful #doyourthing @fucktyler
5819ce36-9c33-46d7-a28c-c72562375305,"Someone suggested I listen to an episode of @SFSqueecast. I got to the gay rape joke and turned it off. I don't need that shit, ever."
5a78e03e-6dc8-4d68-82d5-51e4721ae754,RT @DiamondLakim: When you know who df you is none or this Twitter shit matters!!!! This shit is COMEDY!!!! For laughs !!! Like df
2039af7e-3967-47d2-828a-6b88cda9b934,Outside of Keivan's house screaming like an animal and kicking the fuck out of my dumb ass bitch nigger ass car.
d6f36109-0c4c-4f9c-b94f-79beb70ad05e,"The so-called Christians who support Trump are NOT in any way Christians. Trump is the Antichrist and his followers are Radical Antichristian Terrorists (RATs). Going forward, that is how you must refer to them. RATs."
ea845e3b-1e44-4146-9661-753e58ae94a6,I look better than the girl(s) that bullied me in high school. they called me ugly everyday. I was in 9th grade. 5’1 and 100lbs. They were juniors &amp; seniors.
08b82614-fad6-48ee-b96d-d42d1609e92d,"I don't think Virgil should be Cancelled, or whatever. I just don't think that joke is funny and it's a gay rape joke, and it's dumb that he couldn't just say ""My bad, sorry"" and delete the tweet after queer people (some of whom I think are friends of his) said ""That's not funny"""
7c211117-3222-43f6-8179-1acd347291f7,our freedom fighters constitution builders have. Why I don’t support CAB. A nation can never develop with a radical religion idealism countries like turkey Pakistan are the example. What will happens if tomorrow America or Switzerland become a Christian nation ???? Who knows 2/4
903bd43e-7319-423e-bd70-163106a37ff0,A few months ago a girl who bullied me in high school sent me a message saying I bullied her in high school I was so confused so I had to verify with my other high school friends. I was this close to apologising to her for what she did to me ayas zvakaoma
6d910ced-84ad-4d2d-be5d-ca7a6fb154a6,@98Halima @BilalIGhumman @johnnygjokaj @cdnKhadija @rfrankh53 ISIS has slavery because the prophet Mohammed was a slave owner and trader.
0e4bde95-253f-42c1-9c97-a129ac6e847b,Any idiot can face a crisis - it's day to day living that wears you out. -Anton Chekhov
de94d4f8-7e19-4b3e-bcd1-d17ef8357aa6,@utaunenami_bot Is it okay that I punch every guys who is bullying you? :)
3b855a26-4cec-4588-b00c-d8016fc9dd15,"You firstly ban the us agency which points finger on human rights and religion freedom in india,your agencies are rotten fish and rotting world also.only u can do it,anarchism,Islamic terrorism and black white racism won't work,please crush,these are fake democrats but communist"
280b3017-fcf5-4176-b8e5-36999eb24539,"1. Gay jokes or making fun of weak men 2. Jokes about Communism 3. Observational racial humor, typically done by blacks. 4. Rape jokes 5. Gallows humor"
faeda789-3a70-4477-9bfe-7291f6b3d407,I feel horrible saying this but a girl who bullied me in high school has gained a massive amount of weight and I just feel like that's some kind of karma
6e38e8cd-7d2e-45c1-beea-e26d24240589,"Get on her a** ----> RT “@tayyoung_: FUCK OBAMA, dumb ass nigger”"
3bb0fb59-1e4b-45e8-9ba5-1f2d44a00e2c,@SubmerseChill what mock account?
bef30836-44c0-4f6c-9802-4915f58b380c,Me: what I'll bEAT yo ass
cbccb5cb-031a-4420-b47c-88c964177ada,@AbuYigitAlCahrz @LeonardoMaxwel1 Could that be because Islam declared war on humanity 1400 years ago? http://t.co/xZjOzUQnZx
274821dc-36d5-43c9-82e5-cec711e05b37,"In the span of 24 hours, two different men have asked me how many relationships I've been in. Got me wondering, how does this info change anything at all? Thinking about it, I rem that people have asked me about this in the past too."
5e85b3fb-e043-4e94-b3f5-2925918d9b34,"Wired | Curbing Online Abuse Isn't Impossible, Here's Where We Start http://t.co/MJEj6niarc"
0a7320c7-5374-4525-80f2-5448a3159572,@Weeezza you must have been drunk five minutes into #MKR2015 #MKR
fbb5c68b-7583-4f89-8835-72773457a258,LOOOOL FUCK you do shit you dumb nigerian cunt black nigger ass bitch
6f0375fd-5cc6-4787-987e-43ffab87d62e,girls who bullied me in high school are fresh cheeses now and im uwu
dec15014-ed86-4825-8ecc-27e6c7353fc8,#MileyCyrus Miley Cyrus causes controversy with date-rape 'joke' at GAY club gig in London http://ift.tt/1jm2uyJ
f8d8918b-ff57-410d-a148-a56b8e5b76ac,I think that the USA and Canada really need to look at the types of people who are attracted to the role of politician. We need a way to weed out the wannabe authoritarians early. Defining what is bar food to threaten struggling business owners?!? School yard bully BS.
df00a776-542d-43cb-b603-155aa99519ee,And there has been no mention of black lives over the past few weeks—the shift is now about removing history. Anything ANTIFA (via its antiAmerican financiers) deems offensive has become the target—but where is popular vote? Why do antiAmerican rebels get to call shots?
2ccdc8fa-fecd-4a1e-afd6-e5e6cfee2f22,@Dreysander1 Sons are at much greater risk now than daughters because of feminist laws.
a01fade5-1fec-4916-9644-3201c4e3f658,Why do bitches who were rude to me in high school have “be kind” in their bio. I’m going to message and be like hey girl are u a nursing major cuz u bullied me in high school :)
87c4baff-ebdb-411f-9b16-910ab9c72c8b,"Call me disgusting then! Because if any non BLACK person, especially a white one, calls me a nigger I’m going to slap the dogshit out of them too...it’s a new day for the Karens around the world."
312a1c92-f6e4-4113-82bd-94b9b848eeef,"It's a super funny rape joke. Cause rape is funny. Also it's gay. Gay is funny too. Oh, and Maher is terrible."
7aea65f1-0fa8-4522-ac2e-d124c19879e4,She says as niggas joke about rape and murdering gay people
78823d7e-b7cf-4168-bb97-d5bceaa79a30,I just want u to know if ur a girl who bullied me in high school when I really needed even one person to just be my friend and u think we’re good now we aren’t unless you’ve actually apologized to me
dfcc1c96-1b29-474e-bb7e-7f354aa2fba0,"Lmao you can keep that kinda maturity. I call this being a sad bitch lmao. Which I’ve been, plenty of times."
d9288185-466e-4a6f-a824-2612d81b4f98,Couldn’t the director find a woman to play the role? Why are these men being asked to put on dresses? cause niggers is DUMB AS FUCK
824bd64d-1694-4b6f-9e81-0e56cd79d92c,The rest of the gang were Muslim. This idiot was obviously influenced by the rest. We don't claim him. You can keep him.
f57a3b2b-3b30-4ccb-97d6-68e1bbed49a2,These people are F-ing nuts. So the first or second generation European American citizens who had no part in past wrongs will have to pay up? And just how black or Native American do you have to be to receive anything?
5c82976b-5d5e-484b-bdef-52a6756707d9,"The two accounts I reported (@fart2continue and @imh8bit) were both suspended, but this is not a good response."
7d493ced-674e-49f2-ab72-6e65c24d9782,"mutherfucker @Blank_Mane just insulted me by asking me am I drunk First of all dumb fuck it's a MONDAY night,&amp; my child is home smh nigger"
088a96ae-34f6-4d94-a573-94cbe1f7de26,"I’m going to have to disagree with you. That’s basically the same as saying bullies, whether at home or school or both, isn’t the main reason why kids shoot up schools."
5d6f29b7-1f14-4c9f-af14-08d52031eaab,read the last line idiot list for muslim and quran...written by a muslim why not post original you guys just interpret anything and make fool of public and other followers but as this guy is saying you dont belive in democracy
b92755df-5239-499a-a78b-4e5ad1ceffc1,"@MalickBee Already did.  Found out that Islam is a vile, bigoted, hateful, murdering, sexist, slavery supporting cult."
20101bdc-5f7c-4ce3-a06e-2fdd8e3d3ba6,Loool RT @LemmySODMG: With condom sha RT ImFunkyDee: Fuck a dumb Nigger....
b57ce81a-c4bf-489c-abf5-2b9a1b035cfd,@CamRaw5_Davis i didnt ask to fuck you dumb nigger
b2e2a25f-6ca7-401b-a763-99b9b850e3df,@GlennF @ChrisWarcraft i loved him as FSJ. i hated him as himself.
e0efb8f9-d228-4fe9-ba76-3719d199d976,@LoubnaMalek: 'Being a nigger' should not be an excuse for you to behave like an animal you dumb fuck. Lawdd girl said nigger
a5b21b7e-d0cd-425f-8f5c-bcfdd3d3621d,Many reasons. Primarily the country doesnt have independent economy. They are dependent on larger ones. Also u can bully citizens to send children to school and go to work but u cannot bully people to spend money and keep the economy going..
56ed3dff-ee8b-49b3-a962-33bd3f9d6b96,"Yeah, I get threats. And it means I have to be cautious. But really, I'm crazy enough to think I'm unbreakable, which is why this works."
f9f158f5-d711-40bc-b5b2-47274d87d02c,@gamergatetxt @Cernowatch @PlayDangerously gaters trigger too many false positives. He would lose his valid follower base.
44597093-9989-49dd-a4ba-dc098ff8f1c1,From the picture it looks more like a prison rape joke instead of a gay joke. Where you see soap i see lube.
61fbcca6-1464-4792-bb9e-6e972bd42f8c,"I've learned at school that twelve year olds use gay as an insult, call boys girls as a joke and as an insult, and make rape jokes"
456b9b90-b780-46ad-8700-17afa9092ad1,"Poisoned chalice.She won't be accepted down there. A school bully who will be totally out of her depth. Without media mythology, she's a substanceless husk. Her &amp; lady moanyface are same ilk. Plus once Scotland is independent her revenue stream will be cut! It'll be a paper title"
bf60580f-89c0-4b9f-8028-69fbd5e18b14,"@TheMorningSongs just wifi or over wired, too?"
e34df165-9625-48c8-a3f2-a125dba5a5c6,Me: Girl who bullied me in high school:
272b7303-d231-4263-a304-0161f1c7788e,@JasminePore: If you dressed up as a cat for Halloween you are basic. ...or a pussy
83ea07b7-5fd5-4153-9884-ffb18c0a101e,This one has already passed forgiveness test... you just wait for the question first then you will know that he has all ur secrets
1ded31d4-6816-4088-964d-87034283c7c1,"Jeff, please, stop calling that a ""dumb move"". ""Nigger"" is one of these powerful words just like ""cunt"" or ""fuck"" etc."
42d9194b-cf12-4ea0-ab63-6780adc338a7,Miley Cyrus makes date rape joke onstage at GAY http://www.theguardian.com/music/2014/may/12/miley-cyrus-date-rape-gay via @guardian
fee1d17b-e1b6-4d38-8223-d085a3466649,Whassup?! #coon #bunny #cute #pet #petstagram #cool #swag https://t.co/ZXjRlLP0tZ
6a372396-570e-4b3a-865a-b3f5620d258d,Pakistan do jihad to serve humanity by sending proxy terrorist like kasab to Mumbai lol our Doctors are million time great than Pak jihadist
01d7626d-e8b8-454a-847f-392633a8fa8f,"If you Go against tsmy . Whats wrong with his decision to join UMNO , PH will not win next PRU , why? Because of ramasamy , kullasegaran and santiago . So what u did as A PM. At the time this idiot were talking about Muslims ? U were silent, u dont have the power that u had ...."
bb90c711-385d-4de9-91c6-802c2f363e57,Similar experiences when moving to towns and schools as a kid. Stand up to bullies in the first week and then no issues
b84d45a4-0f3c-43a4-aa12-f877a5ccb85d,@Tez_SofakingFly dude leave my knee alone ! Gosh you bully
0f0cf06e-767c-41aa-86c2-a417dc345ea0,@BelieveTed i feel so fucking bad for you. You dumb fucking nigger im Doxing you and im glad you live in michigan im beating the fuck outa u
2f43c7bf-3557-466b-9fe7-779b13f47c37,A bunch of high school bullies with a hard on for violence who know they can hide behind their badges. Defund the f*ckers.
d49f5531-b9ac-4aa6-bb1b-c32958d88628,"@Fuck_Kasper lmao no i think everyones dumb as fuck for freaking out on her like that, like Mel Gibson said nigger too who gives a fuck lmao"
f3d9bbc3-bc48-4154-b50b-cc88edfb52f3,@tighmir fuck u . u dumb ass stank ass nigger . there is a diffrence between black people and a nigger and u deff a nigger . so fuk ya bitch
6bc3681a-dca3-4512-9dfb-1cc45d77c44e,"@teddyboylocsin @tweetybird2009 @PatVPeters Mohammed had people,who disagreed with him murdered. ISIS murders the same."
e0200a63-cd12-4bb3-9451-20c9f525b6c1,"@0xjared @Zython86 @m_m_myers @ChrisWarcraft anytime they bring your family into it, it's meant to keep you quiet."
f2b24804-f8cd-42e8-b038-375b0e867fb6,@mattjbaldo I just did.
07a049aa-a9c5-4c69-be10-c0b34a7c2069,Mariah is a little bully.. http://myloc.me/mcj1W
e865d92a-9a87-435d-8881-3652f0c491b0,i am literally quaking in my boots right now. you keep your satanic chants away from me. i am a good christian woman.
e78deb5e-6d80-40d3-915c-cc7796b9b38c,"@kmx1974 Google ""financial abortion""."
f212bfdd-9765-43fb-93fc-554ec259d2b8,So what about @POTUS Trump and his affinity for the #Nazis @netanyahu? You are aware that the radical US Christian right support Israel because they hope for the second coming of Christ and world's destruction? Right? Hello? Anybody home? @Jerusalem_Post @usembassyjlm
36aca1fd-0e92-442b-bd7f-03a8a79b3210,Is this lang? @JackLilley5 Not sexist but sports women is the worst thing what's ever happened to sky sports news! #thatswhatloosewomensfor
4b23e892-068f-4a85-9172-f0ece3ddde9e,RT @mitrebox: Guy who stabbed two people at busstop has face that says I'm going to stab you at a bus stop. http://t.co/nAp4hHbfUc
18a844d6-b643-4f19-b9fc-4273f18fd1a3,"#BoycottChineseProducts Definitely, I agree with you. This is what needs to be understood by idiots commenting about iPhones or labeling people as bakhts. Aur kami rah jaye toh start playing the Muslim card."
5917ac06-2a9f-4c5f-b9b8-16e8010e5eae,"hello miss Shukla, correct ur words Jihad is the pious word it's not terrorism, Jihad means to fight against injustice, fight for peace, fight for humanity, fight for rights and to fight wid ur own greed. And Kashmiris may be Jihadis but not terrorist. Mind it"
6194999b-13e8-4c00-bc92-5fb70f7e35b6,This Anger can't b of Hindusthani-Muslims It is anger of BRAINWASHED Muslims-Jihadis-Terrorists want to create Dar-ul-Harb JIHAD&gt;for Enslaving-Converting-Bleeding-Dividing-Demonising Hindus-Hindutva-Hindusthan-Humanity Q needs to b Either REFORMED OR CREMATED&gt;No other Alternative
1b433fe8-85c5-4610-809d-081f14dc3f71,"some of y’all talk about bakugou like he was a mass bully in middle school. yes he was an absolute asshole but he only bullied midoriya, largely because he was quirkless (which obviously isn’t okay) but damn he didn’t bully everyone he layed his eyes on."
fa9d09ae-4bf1-4c54-a43a-54409a1ac626,I keep losing followers. Fuck you dumb niggers.
c3bb02f0-c674-4032-b54c-57a4a54525be,@tassadezae_ @KeepOnHoeinUHo @Paraxtoo piece of shit. Have you seen yourself? Fucking ignorant asshole. Dumb fuck slag on niggers okay hoe
27d0bc72-7ce3-46c2-8090-30ae08987366,"When Ms. McCain rightly criticized the ugly cartoon as anti-Semitic, the bilious caricaturist dismissed her judgment as 'hilarious.' 'A Christian woman is saying a Jewish cartoonist is anti-Semitic.' Well, yes, precisely. And she’s right."""
6e897366-a882-4055-8148-67ddc3e33525,"Oh. there goes @wadhwa using his position to shame @shanley publicly again over her sex life. SET YOURSELF ON FIRE YOU SEXIST SCUMBAG, thx."
4a1349d5-1b20-4915-a65e-6c5e1c2f8c1f,"I mean, why would GamerGate care about a video where people read the abusive tweets they've received? What does this have to do with ethics?"
5d8361bc-11b8-42aa-8755-72b80e2acb94,@MasonJarvis @RiannePageeX @frankiethedug The fucking man like! Ma maws banned him from the computer that's how he's no been on in a while
2de6bc17-84d5-4f2a-bd56-2f8d7c79f794,THE WAYYY GIRLS AT THOUSAND OAKS HIGH SCHOOL BULLIED SO MANY GIRLS FOR THIS?? WHY??
201e977f-8dbc-4d4f-8dbd-6024c82a1eb6,@RawrrShesClassy lmao you a damn fool 😂😂
87e4f07d-9e88-45e2-841f-b05713d447de,"Ok so, roblox (including royale high) turned into a rude game...because of all the rude people there. Today a girl sweared at people. And not only today. People get bullied in royale high as well. So can people stop this...It hurts to see people get bullied. This is serious! Stop"
b52dac7a-4009-4004-b2ad-fe2411f0a7bc,"hey girl! sorry I haven’t talked to you since I bullied you in high school but have you considered taking a risk and investing in something AMAZING &amp; WORTHWHILE, all while supporting small business?!"
cfaec7a3-d6f2-4dda-8c9a-c536f6f95b6c,FROM ISLAMIC TERRORISM TO CORONA TO STANDARD BLACK BRUTALITY BY U.S AUTHORITIES... THIS MAKES AMERICA GREAT
e7449c0d-97ca-4ff4-bd4b-6ec623498d8d,Dev week matches my outfit! http://t.co/s8i4HDWqMV
0f744dd1-df16-4322-bed6-7fe9a5707041,"Idiot there are many Muslims in CRPF, don't misguide he was abusing police and CRPF so he got lessons, write reason also if you know, don't spread fake news."
62bea3f4-9abd-4e16-a2b4-cce4c6bf38a3,"RT @LouisRITHPotter I'm not sexist, but sometimes women proper need to stfu http://t.co/mgTp6Tst9N"
6100d629-12a6-4efb-93d8-358a7a49359f,@BRIGHTPRIMATE @ChrisWarcraft give it time.❤️
fa329ff4-d702-416e-bb53-b817cbad91d8,Bitch you shit was on ma feed... like what the fuck ... its not even Tuesday here... dumb niggers retweeting obviously https://twitter.com/ashleymonrosm/status/1017092316752990210
1f05e6c5-c3e4-450f-ad74-2766bb086177,"@AmitShah @ZeeNewsEnglish @BDUTT barkha u wish to bring India in shameful position in glob, but in entire world only &amp; only muslims r spreading terrorism &amp; secular journalists proves that Indian secular journalists r funded by Islamic terrorism."
836bc1a1-5b5b-4e19-8dfc-82fcfd2b3b2d,"Hey hey hey guys! TRUMP is the worst, #trump #impeachtrump #FBI #SteveBannon #THETRUTH you all a bunch of fucking iâ¦ https://t.co/yUWEhgmx8g"
6f760cbf-2a7a-452e-8ee8-e1fa26e630ef,Same experience - total bullies at my school
a888734b-b69f-4990-b3b8-4e865a7feeab,"You know, it sometimes becomes harder and harder to say not all cops are bastards when you see the people sworn to protect you being on the same level as a high school bully Fucking assholes"
09b2ae7e-1554-468b-a8fd-f659ce09f7a3,“@Shelly_Smyth: I would never fuck a black nigger they ugly and have aids”--&gt; aha you dumb fuck !
9a26714d-a915-4958-b026-ecfc19bc1d48,@evyncollins just because you were abused and you're gay does not give you the right to make jokes about rape
2a306ba7-4ec8-4c66-a1df-616acec6a253,"first of all, no matter how much women say they hate men, they never say ""males"". men on the other hand call women ""females"" akin to how they'd say ""bitches"". secondly, not every woman is female, woman is a gender orientation while female is ""sex"" aka XX chromosomes -"
2b3da3cc-873d-4db2-b1af-19589bde479d,No. You are talking like Modi. Forcibly converting historic worshiping places of other religions(Babri Masjid) into your's. I guess Israel is now also free to carry out the conversion of muslim 'alBeit alMuqaddas' into jewish 'haBeit haMikdash' temple. Medieval idiot.
13d413b4-8a9d-4f3c-b031-b6df77469a2e,38 year old father acts like a middle school bully. Keem is stuck developmentally at about 11 years old.
cb1ff527-f76b-4581-a85f-0b12c8764998,@Friday13 @DarkSim7 @InvisibleJimBSH @iam8bit your mom was uncalled for.
c9b4e1ba-5191-4c74-8bf8-9eaca0bfe564,.@shelbylynne74 @TigerClaud Ahem... http://t.co/xeNJ5eX1Kh
9709dddf-3013-4ffc-8177-d68d95761597,"RT @facerealitynow: @thisonesakillaa I actually got an answer from a feminist today, a remarkably stupid one but an answer nonetheless http…"
53843722-aef7-4058-9e95-445e729fc282,Crazy how people that use to be bullied in school turned out to be full blown dumbass bullies themselves when they become adults
3ab3691c-3571-4416-9820-ee4de4119828,"HOLY CRAP BATMAN, THOSE NIGGER WINCHES GOT US LOOKING LIKE COMPLETE IDIOTS IN THE PRESENCE OF MUSLIMS! LET US USE THE DUMB AS FUCK RAP"
4835f146-38fd-40d2-8b83-e3fd74cf8708,RT @rfc884: I'm not sexist but I bet if I had one month of training I could do all these snowboard tricks the girls are doing and I've neve…
ba8a417d-12c4-4271-a0c6-989207b795ab,"@dampscot yup, i'm aware. :)"
3ec23fbf-2bcb-4efc-b267-813ec433d380,"This thread makes me so angry. Just TWO YEARS AGO some dick of a showrunner, whom of course was white, called this man his ""resident Negro"". This is so disgusting. I hope with the wake-up happening right now that change will happen in Hollywood, too."
08e818b0-a2d2-4bd2-b481-cf9559ed2f12,"Again you relate it with religion. My problem here is some idiots relating my country (Azerbaijan) with terrorism. Actually when it gets to pogroms and other stuff, yes Christians also killed muslims. The first crusade by Pope Urban II in 1095."
09310fa7-1788-4bce-b150-4a70a98bc88d,"watching the interview just because it's streaming on Netflix, 5 mins in: gay jokes, poo jokes, rape jokes. YAWN AF"
7b2bcb04-8f25-42a8-8854-6bfaebf52525,that was so brutal
7b538a6c-b1cd-4822-9761-d94e724dbeb3,RT @AlejandroDaGr8: RT @drumbeats4peace: Woman in Atlanta who was killed by police yesterday is #AlexiaChristian. She was indeed handcuffed…
2ab64685-9e22-4e04-b5eb-c14898a082e7,shouldn't call women bitches cuz female dogs are loyal
d7a34ea4-0123-4d6f-8d19-22298e571969,Mrrglgrgl.
86592d6a-8f73-401f-a1f7-865784c52743,one time i got kind of bullied in high school bc this girl who was directly in my line of vision every day always dressed really normal but like ONE thing about her outfit would be so wrong that i couldn’t look away and she told her friends i stare at her
6bdb2920-1279-4cb3-b2b4-ac7ce4b4e4ae,"Black Lives Matter is a radical, Marxist, anti-capitalist, anti-semite, anti-Christian, anti-family movement that is filled with a bunch of liars who are corporate shakedown specialists. Why would anyone support that"
4f13ea48-9c90-485f-a813-44f7084e16bd,"@danielzklein hmm. i haven't played in a few weeks. last time i was on, he had that creepy amazing new skin. I couldn't stop laughing."
c4f6a2c0-367b-402d-b4cf-0aae93597a8e,Definitely you have full package Brexiteers. 1. False nation 2. 2 faces. 3. Racist. 4. Imperialist. 5. Nationalist from middle ages. 6. Jealousy and hatred. 7. 20 millions Muslims in Uk 8. Collapsed nation Brexiteers. 9. Idiots.
3ace3c7e-222e-4f39-9028-a5444f8662b4,"SMH “@tayyoung_ FUCK OBAMA, dumb ass nigger”"
579213a5-b227-43d8-b6e6-46bfd7f43ab5,"I don't know many people who confuse sex with rape. The point is that the ""joke"" is both trivilizing rape and stigmatizing gay sex. Your clarification is completely unnecessary."
463033f3-209f-4edf-b153-e45c396830b5,"@houmayor Ur An Utter Disgrace &amp; Abomination To God! Ur What Malcolm X, Called A ""HOUSE NEGRO""! How Does It Feel Knowing Ur Still A ""SLAVE"" To The White Man? @texasdemocrats @TXlege"
6f905db3-7e13-40e5-8011-78a0b3fc9910,"@krainboltgreene now i'm unreasonable? heh. okay. in sj terms, that would be gaslighting. :)"
768f268e-6ca3-48a2-9c3e-66b2a217f883,"What an idiot you are! In fact you have exposed your own hypocrisy! You guys come out in blaming every Hindu rituals but when it comes to Muslims, you guys run away. Last time you tried a bit and we know how you were thrashed!"
08614173-e116-4724-ac6f-74a0760b32b2,"White RACIST parents: Sh*t like THIS, will have your kids ONLY F*CKING W/""NIGGERS"", just to SPITE you, DUMB FUCKS https://twitter.com/BlackToLive/status/861244182324793345/photo/1"
